ID,Text,Comment
AnalyticsConsent.Agree,"Ja, ik ga akkoord",
AnalyticsConsent.Disagree,"Nee, ik ga niet akkoord",
AnalyticsConsent.Header,Gameplay-gegevens,Header of the panel that allows the player to consent to sending user data to the developers.
AnalyticsConsent.Info,"Help ons om het spel beter te maken door gegevens te verzamelen over hoe je Timberborn speelt.

Als je akkoord gaat, verzamelen we automatisch gameplay-gerelateerde informatie tijdens je speelsessies.

Je kunt naar de in-game-instellingen gaan om je toestemming in te trekken en je gegevens op elk gewenst moment te verwijderen. Zie ons <link><u>privacybeleid</u></link> voor meer informatie.

Bedankt!",
Attractions.LoadRate,Populariteit,Header above a panel showing how popular an attraction is in each hour during the day
Attractions.Visitors,Bezoekers,"A header above a list of beavers visiting an attraction, such as a campfire."
Attractions.VisitorsLimit,Bezoekers: {0},{0} stands for capacity. Tells players the max capacity of the attraction in a shorter way
Autosave.Success,Automatisch opgeslagen,"Notification on top of the window when autosave succeeded. Keep short, it disappears after 2 seconds"
Autosave.Failure,Automatisch opslaan mislukt,Notification on top of the window when autosave failed. It disappears after 10 seconds
Autosave.FailureDueToFullDisk,Automatisch opslaan mislukt vanwege onvoldoende opslag,Notification on top of the window when autosave failed. It disappears after 10 seconds
BatchControl.Distribution,Distributie,Title of the distribution panel
BatchControl.Housing,Huisvesting,Tooltip of a tab allowing to manage housing buildings.
BatchControl.Mechanical,Energie,Tooltip of a tab allowing to manage mechanical buildings. Power must be the same as used in Mechanical.PowerInput and other Mechanical. keys.
BatchControl.Migration,Migratie,Title of migration panel
BatchControl.NoDistrict,Geen district geselecteerd.,Shown when no district is selected on some batch control tabs
BatchControl.Population,Bevolking,Tooltip of a tab allowing to manage population.
BatchControl.ShowInfo,Nederzetting beheren,Button opening a window to view and manage multiple buildings and characters at once . Please keep short
BatchControl.Storage,Opslag,Tooltip of a tab allowing to manage warehouses.
BatchControl.Workplaces,Werkplekken,Tooltip of a tab allowing to manage workplaces.
Beaver.Adult.PrefabName,Volwassen,
Beaver.Adulthood,Volwassenheid,Next to a progress bar that shows when a baby beaver reaches adulthood.
Beaver.Age,Leeftijd: {0},"{0} stands for number of days, for example 'Age: 5'."
Beaver.Child.PrefabName,Bever kind,
Beaver.DeadNameSuffix,(dood),Preceded by beaver name and age
Beaver.DiedOldAge,{0} stierf door ouderdom.,{0} stands for beaver name
Beaver.Employment,Werkgelegenheid,Header of a section that tells of how many and where beavers are working
Beaver.GrewUp,{0} is opgegroeid.,{0} stands for beaver name. A notification that a beaver achieved maturity.
Beaver.House,Woont in: {0},{0} stands for Building.DisplayName. Tells which type of building the beaver resides in.
Beaver.Homeless,Dakloos,Signifies that the beaver has no home
Beaver.HomelessPlural,Dakloos,Label before number of homeless beavers
Beaver.Launched,{0} werd gelanceerd.,{0} stands for beaver name. A notification that a beaver has been launched in a plane.
Beaver.PluralDisplayName,Bevers,
Beaver.Population.Adults,Volwassenen,Label before number of adult beavers
Beaver.Population.Children,Kinderen,Label before number of kit beavers
Beaver.Population.ContaminatedAdults,verontreinigd volwassenen,"Label before number of adult beavers contaminated by badwater. ""Contaminated"" should be similar or same as Need.BadwaterContamination.DisplayName. Ideally all uses of the word contaminate/contamination/contaminated should be uniform across the project."
Beaver.Population.ContaminatedChildren,Verontreinigd kinderen,"Label before number of children beavers contaminated by badwater. ""Contaminated"" should be similar or same as Need.BadwaterContamination.DisplayName. Ideally all uses of the word contaminate/contamination/contaminated should be uniform across the project."
Beaver.Population.Contaminated,Verontreinigd,Header of the list of beavers contaminated by badwater. Should be similar or same as Need.BadwaterContamination.DisplayName
Beaver.Unemployed,Werkeloos,"Signifies that the beaver has no job, singular"
Beaver.UnemployedPlural,Werkeloos,"Used in population statistics, followed by the number of unemployed beavers"
Beaver.Workplace,Werkt bij: {0},{0} stands for Building.DisplayName. Tells which type of building the beaver works in.
Bonus.CarryingCapacity,Draagvermogen,How much stuff a unit can carry
Bonus.CuttingSuccessChance,Snijdkans,Cutting chance when cutting down a tree
Bonus.GrowthSpeed,Groeisnelheid,Speed at which young beavers grow up
Bonus.LifeExpectancy,Levensverwachting,The presumed length of beavers' life.
Bonus.MovementSpeed,Loopsnelheid,"Describes how fast character can move (bonus to walking, running and swimming)."
Bonus.Source,{0} ontvangen door:,{0} stands for Bonus name. Header above a list of needs that give this bonus.
Bonus.WorkingSpeed,Werksnelheid,Speed at which the beavers work.
Bot.BeaversPerished,"Laat me maar niet beginnen over de bevers.
Ze hadden alles. Frisse lucht, schoon water.
Nu zijn ze nog maar een vage herinnering.","Text for a game over state, when all beavers have perished."
Bot.Created,{0} is gemaakt!,{0} stands for bot name. Notification that shows when production of a new bot finishes.
Bot.DeadNameSuffix,(vernietigd),Preceded by bot name and age
Bot.DeathMessage,{0} is stukgegaan.,{0} stands for bot name. Notification that shows when a bot breaks down completely (it's destroyed)
Bot.DisplayName.Folktails,Houtbot {0},{0} stands for a bot serial number. Name of bots from the Folktails faction. Named after the fact they are visibly made from wood.
Bot.DisplayName.IronTeeth,Ijzerbot {0},{0} stands for a bot serial number. Name of bots from the Iron Teeth faction. Named after the fact they are visibly made from metal.
Bot.Durability,Duurzaamheid,Label before a progress bar showing amount of durability left
Bot.PluralDisplayName,Robots,"Bots are autonomous robots, who assist beavers in their everyday tasks. They are constructed in factories."
Bot.PrefabName,Robot,A bot is an animated anthropomorphic being which is created from inanimate matter. Timberborn bots are depicting beavers and are made of wood and metal.
Breeding.NutrientBringing,"Voedingsstoffen worden door slepers, werklozen en werknemers na werktijd aangevoerd.","Haulers are the same as in Building.HaulingPost.Description, unemployed as in Beaver.UnemployedPlural, workers as in Work.WorkersLabel"
Breeding.NutrientsNeeded,Benodigde voedingsstoffen:,Followed by a list of nutrients needed to produce a new beaver in breeding facility
Breeding.Progress,Broed vooruitgang,Label inside a progress bar describing production progress of new beaver in breeding facility
BugTracker.Prompt,Je wordt naar een online bugtracker gestuurd op {0}.,An OK/Cancel prompt before opening a web browser. {0} stands for url to bug tracker.
BuilderPriorityTool.Description,Met deze tool kunt je prioriteit geven aan bouw- en sloopwerkzaamheden en het verzamelen van goederen uit puin.,Rubble should be plural version of RecoveredGoodStack.DisplayName
BuilderPriorityTool.Tip,Klik op een item om de prioriteit in te stellen of houd de knop ingedrukt om een ​​groter gebied te selecteren.,
Building.Agora.Description,Een grote ontmoetingsplaats waar bevers met elkaar over hout kunnen praten.,
Building.Agora.DisplayName,Tempel,
Building.Agora.FlavorDescription,"Wanneer de groene bakens branden, is dat een teken voor de Volkstaarten om zich te verzamelen.",Folktails must be same as faction as Faction.Folktails.DisplayName.
Building.AdvancedBreedingPod.Description,Maakt gebruik van een geavanceerd fokproces om volwassen bevers te produceren die graag aan de slag gaan.,Breeding should be the same as Building.BreedingPod.DisplayName
Building.AdvancedBreedingPod.DisplayName,Geavanceerde kweekpod,
Building.AdvancedBreedingPod.FlavorDescription,Het idee ontstond toen een kitten in een ketel vol extract viel en een enorme groeispurt doormaakte nadat hij het allemaal had opgedronken.,"Extract must be the same as Good.Extract.DisplayName, kit is a young beaver."
Building.AquaticFarmhouse.Description,Heeft gespecialiseerde boeren in dienst die <SolidHighlight>watergewassen</SolidHighlight> planten en oogsten.,"Aquatic is a keyword, must be the same as in NaturalResources.Aquatic."
Building.AquaticFarmhouse.DisplayName,Aquatische boerderij,A farmhouse that specializes in water plants.
Building.AquaticFarmhouse.FlavorDescription,"""Er was eens een gerucht dat we vis eten. Walgelijk!"" —Oma Ngonel","Beavers eating fish is a common misconception. Beavers are 100% herbivores. Ma' Ngonel is an almost legendary figure - a beaver grandma, known for her stern hand, cooking skills and respect among both kits and adult beavers. Her name is an inside joke, as our community constantly demands an addition of catapults, mangonels etc."
Building.BadwaterDischarge.Description,"Sluit een Slechtwaterbron af. Kan naar wens worden geopend of gesloten. Wanneer geopend, blijft het Slechtwater stromen tijdens droogtes.","Badwater Source must be the same as Building.BadwaterSource.DisplayName, Badwater must be the same as Good.Badwater.DisplayName."
Building.BadwaterDischarge.DisplayName,Slechtwater afvoer,"Name of the building that can either stop flow of badwater or enforce flow with full power. It's a dome shaped, mechanical building that opens and closes like a camera shutter. Badwater must be the same as Good.Badwater.DisplayName."
Building.BadwaterDischarge.FlavorDescription,Alleen echte bouwkundig ingenieurs mogen in de buurt komen.,This is a reference to a youtuber called Real Civil Engineer.
Building.BadwaterDome.Description,Verzegelt een Slechtwaterbron. Kan naar wens geopend of gesloten worden.,"Badwater Source must be the same as Building.BadwaterSource.DisplayName, Badwater must be the same as Good.Badwater.DisplayName."
Building.BadwaterDome.DisplayName,Slechtwater-koepel,Name of the building that stops flow of badwater when put on its source. It's a dome shaped mechanical building that can open and close by raising the cover up and down. Badwater must be the same as Good.Badwater.DisplayName.
Building.BadwaterDome.FlavorDescription,"Geen slechtwater, geen tranen.","This is a reference to a Bob Marley song ""No woman, no cry""."
Building.BadwaterPump.Description,Een versterkte pomp die in staat is om slechtwater weg te pompen. Lage verontreiniging van slechtwater vertraagt ​​de pompsnelheid.,Badwater should be the same as Good.Badwater.DisplayName. Ideally all uses of the word contaminate/contamination/contaminated should be uniform across the project.
Building.BadwaterPump.DisplayName,Slechtwaterpomp,Badwater should be the same as Good.Badwater.DisplayName.
Building.BadwaterPump.FlavorDescription,"""Ik wou dat de extra beschermende maatregelen ook iets tegen de stank zouden omvatten."" —Suli",Suli is a younger beaver that likes to play tricks on their fellow beavers and isn't related to any faction in particular. Translated name shouldn't suggest a gender if possible.
Building.BadwaterRig.Description,Verzegelt een slechtwater bron. Stelt werknemers aan die slechtwater rechtstreeks uit de bron halen.,"Badwater Source must be the same as Building.BadwaterSource.DisplayName, Badwater must be the same as Good.Badwater.DisplayName."
Building.BadwaterRig.DisplayName,Slechtwater Installatie,Name of the building that stops flow from badwater source and generates Good.Badwater.DisplayName goods (by extracting them from source). It's a mechanical building that needs workers to operate. Badwater must be the same as Good.Badwater.DisplayName
Building.BadwaterRig.FlavorDescription,"Bevers die boven een kokende bron van slechtwater werken, voelen een constante druk.",Play on words with pressure referring to both water pressure and stress. If possible try to adapt the phrase to fit your language.
Building.BadwaterSource.DisplayName,Slechtwaterbron,A crack or spring in the ground spuming badwater. Badwater should be the same as Good.Badwater.DisplayName.
Building.BadwaterSource.FlavorDescription,"""Waarom moeten we de rotzooi van de mensjen opruimen? Oh ja, ze zijn allemaal dood."" —Pina",
Building.ContaminationBarrier.Description,Voorkomt dat bodemverontreiniging zich verspreidt.,Ideally all uses of the word contaminate/contamination/contaminated should be uniform across the project.
Building.ContaminationBarrier.DisplayName,Verontreinigingsbarrière,Name of the building that stops spreading soil contamination that's placed on the ground and is presented as square shape with objects sticking out. Ideally all uses of the word contaminate/contamination/contaminated should be uniform across the project. Barrier should be the same between Building.IrrigationBarrier.DisplayName and Building.ContaminationBarrier.DisplayName.
Building.ContaminationBarrier.FlavorDescription,"""Bouw elke dag een dam, houd het hoogwater tam!"" —motiverende poster","Reference to the ""An apple a day, keeps the doctor away"" proverb. If possible try to adapt the phrase to fit your language."
Building.Bakery.Description,Bakt brood en banket van verschillende soorten meel.,Pastry being a baked good.
Building.Bakery.DisplayName,Bakkerij,Building that bakes bread
Building.Bakery.FlavorDescription,"""Niets is lekkerder dan een warm broodje met een beetje zaagsel eroverheen gestrooid."" —Oma Ngonel","Ma' Ngonel is an almost legendary figure - a beaver grandma, known for her stern hand, cooking skills and respect among both kits and adult beavers. Her name is an inside joke, as our community constantly demands an addition of catapults, mangonels etc."
Building.Barrack.Description,"Praktische, gedeelde huisvesting.",
Building.Barrack.DisplayName,Barak,Barracks are cramped homes for beavers. Not related to soldiers.
Building.Barrack.FlavorDescription,"""Twee Volkstaarten lopen een barak binnen."" —Grap van Ijzertanden","Reference to 'walk into a bar' jokes; only Iron Teeth use Barracks, as Folktails prefer different lodges and are less work-focused than Iron Teeth"
Building.BeaverBust.Description,Een buste van een belangrijk ogende bever.,
Building.BeaverBust.DisplayName,Bever borstbeeld,
Building.BeaverBust.FlavorDescription,Ondeugende kittens voegen graag allerlei details toe aan het gezicht van Ouwe Kazko.,"Ol' Kazko is a legendary forefather of modern beavers, famous inventor, pioneer of rapid industrialization. Kits are young beavers."
Building.BeaverStatue.Description.Folktails,Een beeld van een weldoorvoede bever.,
Building.BeaverStatue.Description.IronTeeth,Een beeld van een hardwerkende bever.,
Building.BeaverStatue.DisplayName,Beverbeeld,Statue of a beaver
Building.BeaverStatue.FlavorDescription.Folktails,Waardoor je trots wordt in de goede jaren en hongerig in de slechte jaren.,The statue shows a beaver with a full belly so it can make one hungry when looking at it.
Building.BeaverStatue.FlavorDescription.IronTeeth,Een ontwerp met een sikkel werd te Volkstaart-achtig geacht.,This metal statue depicts a beaver worker with a raised hammer. Hammer and sickle is an emblem of Soviet Russia. Folktails must be same as faction name (Faction.Folktails.DisplayName).
Building.Beehive.Description,Bevordert de groei van nabijgelegen gewassen.,
Building.Beehive.DisplayName,Bijenkorf,
Building.Beehive.FlavorDescription,"""Je went uiteindelijk aan het gezoem."" —Oma Ngonel","Ma' Ngonel is an almost legendary figure - a beaver grandma, known for her stern hand, cooking skills and respect among both kits and adult beavers. Her name is an inside joke, as our community constantly demands an addition of catapults, mangonels etc."
Building.Bell.Description,Het rinkelt aan het begin en het einde van een werkdag.,This is a large metal bell that rings twice a day.
Building.Bell.DisplayName,Bel,A large metal bell
Building.Bell.FlavorDescription,"""Het is het ochtendgerinkel waar je naar uit moeten kijken."" —Ouwe Kazko","Ol' Kazko is a legendary forefather of modern beavers, famous inventor, pioneer of rapid industrialization."
Building.Bench.DisplayName,Bank,
Building.Bench.FlavorDescription,Af en toe eet een vandaal op openbaar terrein.,
Building.Blockage.Description,Een natuurlijke barrière die water blokkeert. Kan worden afgebroken.,Demolished meaning removed by a worker.
Building.Blockage.DisplayName,Verstopping,"Not a dam since that's another building in game but if not possible it could be called a Natural Dam. Visually, it's a block made out of twigs and loose stones."
Building.Blockage.FlavorDescription,"Het is moeilijk te geloven dat er eenvoudigere tijden waren, toen modder met takken een dam vormde.",
Building.BotAssembler.Description,Bouwt autonome robots die bevers kunnen helpen bij hun dagelijkse taken.,Bots should be the same as Bot.PluralDisplayName
Building.BotAssembler.DisplayName,Robot-assembleur,A factory for assembling bots. Bot should be the same as Bot.PrefabName
Building.BotAssembler.FlavorDescription,"Het begon allemaal met een simpele ""wat als ik vandaag niet hoefde te werken"". —Pina",
Building.BotPartFactory.Description,Zet robotonderdelen in elkaar.,Bot should be the same as Bot.PrefabName
Building.BotPartFactory.DisplayName,Robot-onderdeelfabriek,"A factory for creating bot parts, that are later assembled into full bots. Bot should be the same as Bot.PrefabName."
Building.BotPartFactory.FlavorDescription,"""Klaar! Wacht, wat doet deze schroef hier?"" —Pina",
Building.Brazier.Description,Een vuur in een decoratieve doos.,
Building.Brazier.DisplayName,Vuurkorf,
Building.Brazier.FlavorDescription,"""Wow, dat is heet!"" —Suli",Play on words with lit meaning both lit up and cool. If possible try to adapt the phrase to fit your language. Suli is a younger beaver that likes to play tricks on their fellow beavers and isn't related to any faction in particular. Translated name shouldn't suggest a gender if possible.
Building.BrazierOfBonding.DisplayName,Vuurkorf van binding,A large brazier surrounded by statues of a beaver family
Building.BrazierOfBonding.FlavorDescription,"""Als het niet voor ons is, dan wel voor de toekomstige generaties."" —Oma Ngonel","Ma' Ngonel is an almost legendary figure - a beaver grandma, known for her stern hand, cooking skills and respect among both kits and adult beavers. Her name is an inside joke, as our community constantly demands an addition of catapults, mangonels etc."
Building.BreedingPod.Description,De enige en favoriete manier van voortplanting van de Ijzertanden.,Iron Teeth must be the same as the faction name (Faction.IronTeeth.DisplayName).
Building.BreedingPod.DisplayName,Kweekpod,
Building.BreedingPod.FlavorDescription,"""Kits zijn onze toekomst. We hebben er volgende maand nog twaalf nodig."" —Ouwe Kazko","Ol' Kazko is a legendary forefather of modern beavers, famous inventor, pioneer of rapid industrialization."
Building.BuildersHut.Description,Stelt extra bouwers in dienst.,
Building.BuildersHut.DisplayName,Bouwershut,
Building.BuildersHut.FlavorDescription,Bever-Rome is niet in één dag gebouwd. Volgens de legende duurde het zes uur.,Beaverome is a mythical beaver city built by beavers of many different factions who banded together to work on timber-tech for the greater good of all beavers.
Building.BulletinPole.Description,Een decoratieve paal voor openbare boodschappen.,
Building.BulletinPole.DisplayName,Bulletinpaal,
Building.BulletinPole.FlavorDescription,Bent u gewond geraakt op het werk? U komt mogelijk in aanmerking voor compensatie! Neem contact op met Suli.,Reference to common compensation scam text. Suli is a younger beaver that likes to play tricks on their fellow beavers and isn't related to any faction in particular. Translated name shouldn't suggest a gender if possible.
Building.Campfire.Description,Een plek waar bevers 's avonds kunnen ontspannen en gezellig samenkomen.,
Building.Campfire.DisplayName,Kampvuurplaats,
Building.Campfire.FlavorDescription,Soms zijn vuur en hout een goede combinatie.,
Building.Carousel.Description,Een houten draaimolen voor bevers van alle leeftijden.,
Building.Carousel.DisplayName,Carrousel,Alternative name: Merry-Go-Round
Building.Carousel.FlavorDescription,"""Waar denk je dat je heen gaat, kit? Deze takken zullen zichzelf niet afpellen."" —Oma Ngonel","Ma' Ngonel is an almost legendary figure - a beaver grandma, known for her stern hand, cooking skills and respect among both kits and adult beavers. Her name is an inside joke, as our community constantly demands an addition of catapults, mangonels etc."
Building.Centrifuge.Description,"Zware machines transformeren het gevaarlijke, slechtwater in bruikbaar extract.",Badwater should be the same as Good.Badwater.DisplayName. Extract should be the same as Good.Extract.DisplayName.
Building.Centrifuge.DisplayName,Centrifuge,
Building.Centrifuge.FlavorDescription,Het idee ontstond nadat een draaimolen van de Volkstaarten te snel draaide.,"Folktails must be the same as Faction.Folktails.DisplayName, carousel should be the same as Building.Carousel.DisplayName."
Building.ChargingStation.Description,Een plek waar robots worden opgeladen.,Bots should be the same as Bot.PluralDisplayName
Building.ChargingStation.DisplayName,Oplaadpunt,A mechanically powered building where bots come to recharge
Building.ChargingStation.FlavorDescription,Niet gebruiken met apparaten die niet van Ijzerbot zijn.,"Referring the annoying ""a different connector for each device"" trend in IT. Ironbot must be the same as Bot.DisplayName.IronTeeth"
Building.Clock.Description,Een decoratieve klok.,
Building.Clock.DisplayName,Klok,
Building.Clock.FlavorDescription,Het is moeilijk voor te stellen dat bevers vroeger waterkluizen gebruikten.,Clepsydra is an ancient water clock.
Building.CoffeeBrewery.Description,Brouwt koffie.,Coffee should be the same as in Good.Coffee.DisplayName.
Building.CoffeeBrewery.DisplayName,Koffiebrouwerij,A building that brews coffee.
Building.CoffeeBrewery.FlavorDescription,"Als er geen consumptiebeperkingen waren, zouden de Ijzertanden helemaal niet slapen.",
Building.ContemplationSpot.Description,Een klein plekje waar bevers van de natuur kunnen genieten.,
Building.ContemplationSpot.DisplayName,Contemplatieplek,
Building.ContemplationSpot.FlavorDescription,Hier komen bevers om na te denken over hoe ze de grillen van de natuur kunnen omzeilen.,
Building.CompactWaterWheel.Description,Een compacte generator die waterstroom omzet in energie.,
Building.CompactWaterWheel.DisplayName,Compact waterrad,A water wheel that's smaller than other versions.
Building.CompactWaterWheel.FlavorDescription,"Ja, je kunt het waterwiel opnieuw uitvinden.",A play on 'can't reinvent the wheel'
Building.ControlTower.Description,Een hoog bouwwerk dat een signaal naar nabijgelegen bots stuurt om hun prestaties te verbeteren.,Bots should be the same as Bot.PluralDisplayName
Building.ControlTower.DisplayName,Controletoren,A building that emits a signal to nearby bots
Building.ControlTower.FlavorDescription,"Een robot moet de bevelen opvolgen die hij van de bevers krijgt, behalve als er geen bevers meer zijn.","A loose adaptation of Asimov's second law of robotics (and a hint at the ""sentient AI"" scenario). Bot must be the same as Bot.PrefabName."
Building.Dam.Description,"Blokkeert het water, maar laat een deel ervan door via een overloop aan de bovenkant.",Spillway is a hole near the top that allows for the water to pass.
Building.Dam.DisplayName,Dam,
Building.Dam.FlavorDescription,"Zoals iedereen weet, worden de fundamenten van een beschaving onder water gebouwd.",
Building.DanceHall.Description,Een open hal waar bevers hun staart los kunnen laten.,
Building.DanceHall.DisplayName,Danszaal,
Building.DanceHall.FlavorDescription,"""Kom op, blijf daar niet gewoon staan ​​als een saaie Ijzertand."" —Suli",Iron Teeth must be the same as Faction.IronTeeth.DisplayName. Suli is a younger beaver that likes to play tricks on their fellow beavers and isn't related to any faction in particular. Translated name shouldn't suggest a gender if possible.
Building.DecontaminationPod.Description,Een vat waarin bevers kunnen herstellen van blootstelling aan slechtwater.,Badwater should be the same as Good.Badwater.DisplayName.
Building.DecontaminationPod.DisplayName,Decontaminatie bad,Ideally the name of the building should refer to the contamination effect on the beaver (Need.BadwaterContamination).
Building.DecontaminationPod.FlavorDescription,"""Nee Suli, je mag het extract niet drinken. Je bent in de ketel gevallen toen je een kit was!"" —Oma Ngonel","Reference to Obelix from Asterix and Obelix falling into a cauldron. Suli is a younger beaver that likes to play tricks on their fellow beavers and isn't related to any faction in particular. Translated name shouldn't suggest a gender if possible. Ma' Ngonel is an almost legendary figure - a beaver grandma, known for her stern hand, cooking skills and respect among both kits and adult beavers. Her name is an inside joke, as our community constantly demands an addition of catapults, mangonels etc."
Building.DeepBadwaterPump.DisplayName,Diepe Slechtwaterpomp,"Badwater Pump Must be the same as Building.BadwaterPump.DisplayName, Deep should be the same as in Building.DeepWaterPump.DisplayName"
Building.DeepBadwaterPump.FlavorDescription,De verlengde pijp helpt bij zowel de hoogteverschillen als de geur.,
Building.DeepMechanicalFluidPump.DisplayName,Diepe mechanische vloeistofpomp,
Building.DeepWaterPump.Description,"Pompt en filtert water voor bevers, zodat ze het kunnen drinken.",
